{
  "name": "USS Doris Miller",
  "dbpedia_uri": "http://dbpedia.org/resource/USS_Doris_Miller",
  "wikipedia_url": "http://en.wikipedia.org/wiki/USS_Doris_Miller",
  "wikipedia_title": "USS Doris Miller",
  "country": "United States",
  "subtype": "nuclear aircraft carrier",
  "class": "Gerald R. Ford-class aircraft carrier",
  "configuration": "CATOBAR",
  "manufacturer": "Newport News Shipbuilding",
  "date_commissioned": "2034",
  "date_decommissioned": null,
  "decommissioning_reason": null,
  "in_service": false,
  "displacement": {
    "tons": null
  },
  "pennant_number": "CVN-81",
  "length": {
    "ft": 3628.609,
    "m": 1106.0
  },
  "beam": {
    "ft": 439.633,
    "m": 134.0
  },
  "height": {
    "m": null
  },
  "draught": {
    "ft": 127.953,
    "m": 39.0
  },
  "speed": {
    "km_h": 55.56,
    "knots": 30.0
  }
}
