{
  "name": "USS Tripoli (LPH-10)",
  "dbpedia_uri": "http://dbpedia.org/resource/USS_Tripoli_(LPH-10)",
  "wikipedia_url": "http://en.wikipedia.org/wiki/USS_Tripoli_(LPH-10)",
  "wikipedia_title": "USS Tripoli (LPH-10)",
  "country": "United States",
  "subtype": "aircraft carrier",
  "class": "Iwo Jima-class amphibious assault ship",
  "configuration": "STOVL",
  "manufacturer": "Ingalls Shipbuilding",
  "date_commissioned": "1966-08-06",
  "date_decommissioned": "1995-09-15",
  "decommissioning_reason": "scrapped",
  "in_service": false,
  "displacement": {
    "tonnes": 19611.737,
    "tons": 19302.0
  },
  "pennant_number": "LPH-10",
  "length": {
    "ft": 1961.942,
    "m": 598.0
  },
  "beam": {
    "ft": 275.591,
    "m": 84.0
  },
  "height": {
    "m": null
  },
  "draught": {
    "ft": 98.425,
    "m": 30.0
  },
  "speed": {
    "km_h": 42.596,
    "knots": 23.0
  }
}
