{
  "name": "USS Casablanca",
  "dbpedia_uri": "http://dbpedia.org/resource/USS_Casablanca",
  "wikipedia_url": "http://en.wikipedia.org/wiki/USS_Casablanca",
  "wikipedia_title": "USS Casablanca",
  "country": "United States",
  "subtype": "escort carrier",
  "class": "Casablanca-class escort carrier",
  "configuration": "CATOBAR",
  "manufacturer": "Kaiser Shipbuilding Company, Vancouver, Washington",
  "date_commissioned": "1943-07-08",
  "date_decommissioned": "1946-06-10",
  "decommissioning_reason": "scrapped",
  "in_service": false,
  "displacement": {
    "tons": null
  },
  "pennant_number": "AVG-55",
  "length": {
    "m": null
  },
  "beam": {
    "m": null
  },
  "height": {
    "m": null
  },
  "draught": {
    "m": null
  },
  "speed": {
    "knots": null
  }
}
