{
  "name": "Japanese aircraft carrier Shōhō",
  "dbpedia_uri": "http://dbpedia.org/resource/Japanese_aircraft_carrier_Shōhō",
  "wikipedia_url": "http://en.wikipedia.org/wiki/Japanese_aircraft_carrier_Shōhō",
  "wikipedia_title": "Japanese aircraft carrier Shōhō",
  "country": "Japan",
  "subtype": "aircraft carrier",
  "class": "Zuihō-class aircraft carrier",
  "configuration": "CATOBAR",
  "manufacturer": "Yokosuka Naval Arsenal",
  "date_commissioned": "1941-11-30",
  "date_decommissioned": null,
  "decommissioning_reason": "sunk",
  "in_service": false,
  "displacement": {
    "tonnes": 113.797,
    "tons": 112.0
  },
  "pennant_number": null,
  "length": {
    "ft": 2211.286,
    "m": 674.0
  },
  "beam": {
    "ft": 193.57,
    "m": 59.0
  },
  "height": {
    "m": null
  },
  "draught": {
    "ft": 68.898,
    "m": 21.0
  },
  "speed": {
    "km_h": 51.856,
    "knots": 28.0
  }
}
