{
  "name": "MV Empire MacMahon",
  "dbpedia_uri": "http://dbpedia.org/resource/MV_Empire_MacMahon",
  "wikipedia_url": "http://en.wikipedia.org/wiki/MV_Empire_MacMahon",
  "wikipedia_title": "MV Empire MacMahon",
  "country": "United Kingdom",
  "subtype": "aircraft carrier",
  "class": null,
  "configuration": "CATOBAR",
  "manufacturer": "Swan Hunter & Wigham Richardson, Wallsend",
  "date_commissioned": null,
  "date_decommissioned": null,
  "decommissioning_reason": "scrapped",
  "in_service": false,
  "displacement": {
    "tons": null
  },
  "pennant_number": null,
  "length": {
    "ft": 1519.029,
    "m": 463.0
  },
  "beam": {
    "ft": 200.131,
    "m": 61.0
  },
  "height": {
    "m": null
  },
  "draught": {
    "m": null
  },
  "speed": {
    "km_h": 20.372,
    "knots": 11.0
  }
}
