{
  "name": "HMS Ravager (D70)",
  "dbpedia_uri": "http://dbpedia.org/resource/HMS_Ravager_(D70)",
  "wikipedia_url": "http://en.wikipedia.org/wiki/HMS_Ravager_(D70)",
  "wikipedia_title": "HMS Ravager (D70)",
  "country": "United States",
  "subtype": "escort carrier",
  "class": "Bogue-class escort carrier (USA) *Attacker-class escort carrier (UK)",
  "configuration": "CATOBAR",
  "manufacturer": "Seattle-Tacoma Shipbuilding Corporation, Tacoma, Washington",
  "date_commissioned": "1943-04-25",
  "date_decommissioned": "1946-04-12",
  "decommissioning_reason": "transferred",
  "in_service": false,
  "displacement": {
    "tonnes": 792.517,
    "tons": 780.0
  },
  "pennant_number": "D70",
  "length": {
    "ft": 1525.591,
    "m": 465.0
  },
  "beam": {
    "ft": 226.378,
    "m": 69.0
  },
  "height": {
    "m": null
  },
  "draught": {
    "ft": 78.74,
    "m": 24.0
  },
  "speed": {
    "km_h": 33.336,
    "knots": 18.0
  }
}
