{
  "name": "HMAS Canberra (L02)",
  "dbpedia_uri": "http://dbpedia.org/resource/HMAS_Canberra_(L02)",
  "wikipedia_url": "http://en.wikipedia.org/wiki/HMAS_Canberra_(L02)",
  "wikipedia_title": "HMAS Canberra (L02)",
  "country": "Australia",
  "subtype": "helicopter carrier",
  "class": "Canberra-class landing helicopter dock",
  "configuration": "helicopter",
  "manufacturer": "Navantia, Ferrol, Spain & BAE Systems Australia, Williamstown Dockyard, Australia",
  "date_commissioned": "2014-11-28",
  "date_decommissioned": null,
  "decommissioning_reason": null,
  "in_service": true,
  "displacement": {
    "tonnes": 27941.29,
    "tons": 27500.0
  },
  "pennant_number": "L02",
  "length": {
    "ft": 757.283,
    "m": 230.82
  },
  "beam": {
    "ft": 104.987,
    "m": 32.0
  },
  "height": {
    "m": null
  },
  "draught": {
    "ft": 23.228,
    "m": 7.08
  },
  "speed": {
    "km_h": 37.04,
    "knots": 20.0
  }
}
