{
  "name": "USS Leyte (CV-32)",
  "dbpedia_uri": "http://dbpedia.org/resource/USS_Leyte_(CV-32)",
  "wikipedia_url": "http://en.wikipedia.org/wiki/USS_Leyte_(CV-32)",
  "wikipedia_title": "USS Leyte (CV-32)",
  "country": "United States",
  "subtype": "fleet carrier",
  "class": "Essex-class aircraft carrier",
  "configuration": "CATOBAR",
  "manufacturer": "Newport News Shipbuilding",
  "date_commissioned": "1946-04-11",
  "date_decommissioned": "1959-05-15",
  "decommissioning_reason": "scrapped",
  "in_service": false,
  "displacement": {
    "tonnes": 27534.871,
    "tons": 27100.0
  },
  "pennant_number": null,
  "length": {
    "ft": 2913.386,
    "m": 888.0
  },
  "beam": {
    "ft": 305.118,
    "m": 93.0
  },
  "height": {
    "m": null
  },
  "draught": {
    "ft": 91.864,
    "m": 28.0
  },
  "speed": {
    "km_h": 61.116,
    "knots": 33.0
  }
}
