{
  "name": "USS Bon Homme Richard (CV-31)",
  "dbpedia_uri": "http://dbpedia.org/resource/USS_Bon_Homme_Richard_(CV-31)",
  "wikipedia_url": "http://en.wikipedia.org/wiki/USS_Bon_Homme_Richard_(CV-31)",
  "wikipedia_title": "USS Bon Homme Richard (CV-31)",
  "country": "United States",
  "subtype": "fleet carrier",
  "class": "Essex-class aircraft carrier",
  "configuration": "CATOBAR",
  "manufacturer": "New York Naval Shipyard",
  "date_commissioned": "1944-11-26",
  "date_decommissioned": "1971-07-02",
  "decommissioning_reason": "scrapped",
  "in_service": false,
  "displacement": {
    "tonnes": 275.349,
    "tons": 271.0
  },
  "pennant_number": null,
  "length": {
    "ft": 2690.289,
    "m": 820.0
  },
  "beam": {
    "ft": 305.118,
    "m": 93.0
  },
  "height": {
    "m": null
  },
  "draught": {
    "ft": 111.549,
    "m": 34.0
  },
  "speed": {
    "km_h": 61.116,
    "knots": 33.0
  }
}
