{
  "name": "USS Tarawa (LHA-1)",
  "dbpedia_uri": "http://dbpedia.org/resource/USS_Tarawa_(LHA-1)",
  "wikipedia_url": "http://en.wikipedia.org/wiki/USS_Tarawa_(LHA-1)",
  "wikipedia_title": "USS Tarawa (LHA-1)",
  "country": "United States",
  "subtype": "amphibious assault ship",
  "class": "Tarawa-class amphibious assault ship",
  "configuration": "STOVL",
  "manufacturer": "Ingalls Shipbuilding",
  "date_commissioned": "1976-05-29",
  "date_decommissioned": "2009-03-31",
  "decommissioning_reason": "sunk",
  "in_service": false,
  "displacement": {
    "tonnes": 39524.225,
    "tons": 38900.0
  },
  "pennant_number": "LHA-1",
  "length": {
    "ft": 2690.289,
    "m": 820.0
  },
  "beam": {
    "ft": 347.769,
    "m": 106.0
  },
  "height": {
    "m": null
  },
  "draught": {
    "ft": 85.302,
    "m": 26.0
  },
  "speed": {
    "km_h": 44.448,
    "knots": 24.0
  }
}
