{
  "name": "USS Vella Gulf (CVE-111)",
  "dbpedia_uri": "http://dbpedia.org/resource/USS_Vella_Gulf_(CVE-111)",
  "wikipedia_url": "http://en.wikipedia.org/wiki/USS_Vella_Gulf_(CVE-111)",
  "wikipedia_title": "USS Vella Gulf (CVE-111)",
  "country": "United States",
  "subtype": "escort carrier",
  "class": "Commencement Bay-class escort carrier",
  "configuration": "CATOBAR",
  "manufacturer": "Todd Pacific Shipyards",
  "date_commissioned": "1945-04-09",
  "date_decommissioned": "1946-08-09",
  "decommissioning_reason": "scrapped",
  "in_service": false,
  "displacement": {
    "tonnes": 21740.356,
    "tons": 21397.0
  },
  "pennant_number": "CVE-111",
  "length": {
    "ft": 1827.428,
    "m": 557.0
  },
  "beam": {
    "ft": 246.063,
    "m": 75.0
  },
  "height": {
    "m": null
  },
  "draught": {
    "ft": 104.987,
    "m": 32.0
  },
  "speed": {
    "km_h": 35.188,
    "knots": 19.0
  }
}
