{
  "name": "USS Abraham Lincoln (CVN-72)",
  "dbpedia_uri": "http://dbpedia.org/resource/USS_Abraham_Lincoln_(CVN-72)",
  "wikipedia_url": "http://en.wikipedia.org/wiki/USS_Abraham_Lincoln_(CVN-72)",
  "wikipedia_title": "USS Abraham Lincoln (CVN-72)",
  "country": "United States",
  "subtype": "nuclear aircraft carrier",
  "class": "Nimitz-class aircraft carrier",
  "configuration": "CATOBAR",
  "manufacturer": "Newport News Shipbuilding",
  "date_commissioned": "1989-11-11",
  "date_decommissioned": null,
  "decommissioning_reason": null,
  "in_service": true,
  "displacement": {
    "tonnes": 105.669,
    "tons": 104.0
  },
  "pennant_number": "CVN-72",
  "length": {
    "ft": 3582.677,
    "m": 1092.0
  },
  "beam": {
    "ft": 826.772,
    "m": 252.0
  },
  "height": {
    "m": null
  },
  "draught": {
    "ft": 121.391,
    "m": 37.0
  },
  "speed": {
    "km_h": 55.56,
    "knots": 30.0
  }
}
