{
  "name": "HMS Ark Royal (R09)",
  "dbpedia_uri": "http://dbpedia.org/resource/HMS_Ark_Royal_(R09)",
  "wikipedia_url": "http://en.wikipedia.org/wiki/HMS_Ark_Royal_(R09)",
  "wikipedia_title": "HMS Ark Royal (R09)",
  "country": "United Kingdom",
  "subtype": "fleet carrier",
  "class": "Audacious-class aircraft carrier",
  "configuration": "CATOBAR",
  "manufacturer": "Cammell Laird, Birkenhead, England",
  "date_commissioned": "1955-02-22",
  "date_decommissioned": "1979-02-14",
  "decommissioning_reason": "scrapped",
  "in_service": false,
  "displacement": {
    "tonnes": 37390.526,
    "tons": 36800.0
  },
  "pennant_number": "R09",
  "length": {
    "ft": 2637.795,
    "m": 804.0
  },
  "beam": {
    "ft": 367.454,
    "m": 112.0
  },
  "height": {
    "m": null
  },
  "draught": {
    "ft": 32.808,
    "m": 10.0
  },
  "speed": {
    "km_h": 58.338,
    "knots": 31.5
  }
}
